Ether / IP / TCP 192.168.1.1:domain > 192.168.1.173:59633 FA / Padding
Ether / IP / TCP 192.168.1.173:59633 > 192.168.1.1:domain R / Padding
Ether / IP / TCP 172.64.155.209:https > 192.168.1.173:59176 PA / Raw
Ether / IP / TCP 172.64.155.209:https > 192.168.1.173:59176 PA / Raw
Ether / IP / TCP 172.64.155.209:https > 192.168.1.173:59176 PA / Raw
Ether / IP / TCP 192.168.1.173:59176 > 172.64.155.209:https A / Padding
Ether / IP / TCP 192.168.1.173:59176 > 172.64.155.209:https PA / Raw
Ether / IP / TCP 172.64.155.209:https > 192.168.1.173:59176 A / Padding
Ether / IP / TCP 3.233.158.24:https > 192.168.1.173:59576 A / Padding
Ether / IP / TCP 3.233.158.24:https > 192.168.1.173:59576 A / Padding
Ether / IP / TCP 3.233.158.24:https > 192.168.1.173:59576 PA / Raw
Ether / IP / TCP 3.233.158.24:https > 192.168.1.173:59576 PA / Raw
Ether / IP / TCP 192.168.1.173:59576 > 3.233.158.24:https A / Padding
Ether / IP / TCP 192.168.1.173:59576 > 3.233.158.24:https PA / Raw
Ether / IP / TCP 3.233.158.24:https > 192.168.1.173:59576 A / Padding
Ether / IP / TCP 192.168.1.173:59480 > 185.60.218.53:xmpp_client PA / Raw
Ether / IP / TCP 185.60.218.53:xmpp_client > 192.168.1.173:59480 A / Padding
Ether / IP / TCP 185.60.218.53:xmpp_client > 192.168.1.173:59480 PA / Raw
Ether / IP / TCP 192.168.1.173:59480 > 185.60.218.53:xmpp_client A / Padding
Ether / IP / TCP 192.168.1.173:59100 > 173.194.69.188:5228 A / Raw / Padding
Ether / IP / TCP 173.194.69.188:5228 > 192.168.1.173:59100 A
Ether / IP / TCP 192.168.1.173:59101 > 173.194.69.188:5228 A / Raw / Padding
Ether / IP / TCP 173.194.69.188:5228 > 192.168.1.173:59101 A
Ether / IP / TCP 192.168.1.173:59403 > 185.199.109.154:https A / Raw / Padding
Ether / IP / TCP 185.199.109.154:https > 192.168.1.173:59403 A
Ether / IP / TCP 192.168.1.173:59593 > 192.168.1.1:domain A / Raw / Padding
Ether / IP / TCP 192.168.1.1:domain > 192.168.1.173:59593 A / Padding
Ether / IP / TCP 192.168.1.173:59176 > 172.64.155.209:https PA / Raw
Ether / IP / TCP 192.168.1.173:59176 > 172.64.155.209:https PA / Raw
Ether / IP / TCP 192.168.1.173:59176 > 172.64.155.209:https PA / Raw
Ether / IP / TCP 172.64.155.209:https > 192.168.1.173:59176 A
Ether / IP / TCP 172.64.155.209:https > 192.168.1.173:59176 A
Ether / IP / TCP 172.64.155.209:https > 192.168.1.173:59176 A
Ether / IP / TCP 172.64.155.209:https > 192.168.1.173:59176 A
Ether / IP / TCP 192.168.1.173:59176 > 172.64.155.209:https PA / Raw
Ether / IP / TCP 192.168.1.173:59176 > 172.64.155.209:https PA / Raw
Ether / IP / TCP 192.168.1.173:59176 > 172.64.155.209:https A / Raw
Ether / IP / TCP 172.64.155.209:https > 192.168.1.173:59176 A
Ether / IP / TCP 172.64.155.209:https > 192.168.1.173:59176 A
Ether / IP / TCP 172.64.155.209:https > 192.168.1.173:59176 A
Ether / IP / TCP 172.64.155.209:https > 192.168.1.173:59176 A
Ether / IP / TCP 172.64.155.209:https > 192.168.1.173:59176 A
Ether / IP / TCP 172.64.155.209:https > 192.168.1.173:59176 A
Ether / IP / TCP 172.64.155.209:https > 192.168.1.173:59176 A
Ether / IP / TCP 172.64.155.209:https > 192.168.1.173:59176 A
Ether / IP / TCP 172.64.155.209:https > 192.168.1.173:59176 A / Padding
Ether / IP / TCP 172.64.155.209:https > 192.168.1.173:59176 PA / Raw
Ether / IP / TCP 192.168.1.173:59176 > 172.64.155.209:https A / Padding
Ether / IP / TCP 172.64.155.209:https > 192.168.1.173:59176 PA / Raw
Ether / IP / TCP 172.64.155.209:https > 192.168.1.173:59176 PA / Raw
Ether / IP / TCP 192.168.1.173:59176 > 172.64.155.209:https A / Padding
Ether / IP / TCP 192.168.1.173:59176 > 172.64.155.209:https PA / Raw
Ether / IP / TCP 172.64.155.209:https > 192.168.1.173:59176 A / Padding
Ether / IP / TCP 172.64.155.209:https > 192.168.1.173:59176 PA / Raw
Ether / IP / TCP 172.64.155.209:https > 192.168.1.173:59176 PA / Raw
Ether / IP / TCP 192.168.1.173:59176 > 172.64.155.209:https A / Padding
Ether / IP / TCP 172.64.155.209:https > 192.168.1.173:59176 A / Raw
Ether / IP / TCP 192.168.1.173:59176 > 172.64.155.209:https A / Padding
Ether / IP / TCP 172.64.155.209:https > 192.168.1.173:59176 A / Raw
Ether / IP / TCP 192.168.1.173:59176 > 172.64.155.209:https A / Padding
Ether / IP / TCP 172.64.155.209:https > 192.168.1.173:59176 A / Raw
Ether / IP / TCP 172.64.155.209:https > 192.168.1.173:59176 A / Raw
Ether / IP / TCP 192.168.1.173:59176 > 172.64.155.209:https A / Padding
Ether / IP / TCP 172.64.155.209:https > 192.168.1.173:59176 A / Raw
Ether / IP / TCP 172.64.155.209:https > 192.168.1.173:59176 A / Raw
Ether / IP / TCP 172.64.155.209:https > 192.168.1.173:59176 PA / Raw
Ether / IP / TCP 172.64.155.209:https > 192.168.1.173:59176 PA / Raw
Ether / IP / TCP 192.168.1.173:59176 > 172.64.155.209:https A / Padding
Ether / IP / TCP 192.168.1.173:59176 > 172.64.155.209:https PA / Raw
Ether / IP / TCP 192.168.1.173:59176 > 172.64.155.209:https PA / Raw
Ether / IP / TCP 192.168.1.173:59176 > 172.64.155.209:https PA / Raw
Ether / IP / TCP 172.64.155.209:https > 192.168.1.173:59176 A / Padding
Ether / IP / TCP 192.168.1.173:59176 > 172.64.155.209:https PA / Raw
Ether / IP / TCP 172.64.155.209:https > 192.168.1.173:59176 A / Padding
Ether / IP / TCP 172.64.155.209:https > 192.168.1.173:59176 A / Padding
Ether / IP / TCP 172.64.155.209:https > 192.168.1.173:59176 A / Padding
Ether / IP / TCP 172.64.155.209:https > 192.168.1.173:59176 A / Padding
Ether / IP / TCP 172.64.155.209:https > 192.168.1.173:59176 A / Padding
Ether / IP / TCP 172.64.155.209:https > 192.168.1.173:59176 A / Padding
Ether / IP / TCP 172.64.155.209:https > 192.168.1.173:59176 A / Padding
Ether / IP / TCP 172.64.155.209:https > 192.168.1.173:59176 A / Padding
Ether / IP / TCP 172.64.155.209:https > 192.168.1.173:59176 A / Padding
Ether / IP / TCP 172.64.155.209:https > 192.168.1.173:59176 A / Padding
Ether / IP / TCP 172.64.155.209:https > 192.168.1.173:59176 A / Padding
Ether / IP / TCP 172.64.155.209:https > 192.168.1.173:59176 A / Padding
Ether / IP / TCP 172.64.155.209:https > 192.168.1.173:59176 PA / Raw
Ether / IP / TCP 172.64.155.209:https > 192.168.1.173:59176 PA / Raw
Ether / IP / TCP 172.64.155.209:https > 192.168.1.173:59176 PA / Raw
Ether / IP / TCP 192.168.1.173:59176 > 172.64.155.209:https A / Padding
Ether / IP / TCP 172.64.155.209:https > 192.168.1.173:59176 PA / Raw
Ether / IP / TCP 172.64.155.209:https > 192.168.1.173:59176 PA / Raw
Ether / IP / TCP 192.168.1.173:59176 > 172.64.155.209:https A / Padding
Ether / IP / TCP 172.64.155.209:https > 192.168.1.173:59176 PA / Raw
Ether / IP / TCP 172.64.155.209:https > 192.168.1.173:59176 PA / Raw
Ether / IP / TCP 192.168.1.173:59176 > 172.64.155.209:https A / Padding
Ether / IP / TCP 192.168.1.173:59636 > 192.168.1.1:domain S
Ether / IP / TCP 192.168.1.173:59637 > 192.168.1.1:domain S
Ether / IP / TCP 192.168.1.173:59177 > 104.18.32.47:https PA / Raw
Ether / IP / TCP 192.168.1.173:59177 > 104.18.32.47:https PA / Raw
Ether / IP / TCP 192.168.1.173:59177 > 104.18.32.47:https PA / Raw
Ether / IP / TCP 192.168.1.1:domain > 192.168.1.173:59636 SA / Padding
Ether / IP / TCP 192.168.1.1:domain > 192.168.1.173:59637 SA / Padding
Ether / IP / TCP 192.168.1.173:59636 > 192.168.1.1:domain A / Padding
Ether / IP / TCP 192.168.1.173:59637 > 192.168.1.1:domain A / Padding
Ether / IP / TCP 192.168.1.173:59636 > 192.168.1.1:domain PA / Raw / Padding
Ether / IP / TCP 192.168.1.173:59636 > 192.168.1.1:domain PA / Raw
Ether / IP / TCP 192.168.1.173:59637 > 192.168.1.1:domain PA / Raw / Padding
Ether / IP / TCP 192.168.1.173:59637 > 192.168.1.1:domain PA / Raw
Ether / IP / TCP 192.168.1.1:domain > 192.168.1.173:59636 A / Padding
Ether / IP / TCP 192.168.1.1:domain > 192.168.1.173:59636 A / Padding
Ether / IP / TCP 192.168.1.1:domain > 192.168.1.173:59637 A / Padding
Ether / IP / TCP 192.168.1.1:domain > 192.168.1.173:59637 A / Padding
Ether / IP / TCP 104.18.32.47:https > 192.168.1.173:59177 A / Padding
Ether / IP / TCP 104.18.32.47:https > 192.168.1.173:59177 A / Padding
Ether / IP / TCP 104.18.32.47:https > 192.168.1.173:59177 PA / Raw
Ether / IP / TCP / DNS Ans 104.18.32.47
Ether / IP / TCP 192.168.1.173:59636 > 192.168.1.1:domain FA / Padding
Ether / IP / TCP 192.168.1.1:domain > 192.168.1.173:59636 FA / Padding
Ether / IP / TCP 192.168.1.173:59636 > 192.168.1.1:domain A / Padding
Ether / IP / TCP 192.168.1.173:59637 > 192.168.1.1:domain FA / Padding
Ether / IP / TCP 192.168.1.173:59177 > 104.18.32.47:https A / Padding
Ether / IP / TCP 104.18.32.47:https > 192.168.1.173:59177 A / Padding
Ether / IP / TCP 192.168.1.1:domain > 192.168.1.173:59637 A / Padding
Ether / IP / TCP 104.18.32.47:https > 192.168.1.173:59177 PA / Raw
Ether / IP / TCP 104.18.32.47:https > 192.168.1.173:59177 PA / Raw
Ether / IP / TCP 104.18.32.47:https > 192.168.1.173:59177 PA / Raw
Ether / IP / TCP 192.168.1.173:59177 > 104.18.32.47:https A / Padding
Ether / IP / TCP 192.168.1.173:59177 > 104.18.32.47:https PA / Raw
Ether / IP / TCP 104.18.32.47:https > 192.168.1.173:59177 A / Padding
Ether / IP / TCP 192.168.1.173:59176 > 172.64.155.209:https PA / Raw
Ether / IP / TCP 192.168.1.173:59176 > 172.64.155.209:https PA / Raw
Ether / IP / TCP 172.64.155.209:https > 192.168.1.173:59176 A / Padding
Ether / IP / TCP 172.64.155.209:https > 192.168.1.173:59176 A / Padding
Ether / IP / TCP 172.64.155.209:https > 192.168.1.173:59176 A / Padding
Ether / IP / TCP 172.64.155.209:https > 192.168.1.173:59176 A / Padding
Ether / IP / TCP 172.64.155.209:https > 192.168.1.173:59176 A / Padding
Ether / IP / TCP 172.64.155.209:https > 192.168.1.173:59176 A / Padding
Ether / IP / TCP 172.64.155.209:https > 192.168.1.173:59176 A / Padding
Ether / IP / TCP 172.64.155.209:https > 192.168.1.173:59176 A / Padding
Ether / IP / TCP 172.64.155.209:https > 192.168.1.173:59176 A / Padding
Ether / IP / TCP 172.64.155.209:https > 192.168.1.173:59176 A / Padding
Ether / IP / TCP 172.64.155.209:https > 192.168.1.173:59176 A / Padding
Ether / IP / TCP 172.64.155.209:https > 192.168.1.173:59176 PA / Raw
Ether / IP / TCP 172.64.155.209:https > 192.168.1.173:59176 PA / Raw
Ether / IP / TCP 192.168.1.173:59176 > 172.64.155.209:https A / Padding
Ether / IP / TCP 172.64.155.209:https > 192.168.1.173:59176 PA / Raw
Ether / IP / TCP 172.64.155.209:https > 192.168.1.173:59176 PA / Raw
Ether / IP / TCP 192.168.1.173:59176 > 172.64.155.209:https A / Padding
Ether / IP / TCP 172.64.155.209:https > 192.168.1.173:59176 PA / Raw
Ether / IP / TCP 192.168.1.173:59176 > 172.64.155.209:https A / Padding
Ether / IP / TCP 172.64.155.209:https > 192.168.1.173:59176 PA / Raw
Ether / IP / TCP 192.168.1.173:59176 > 172.64.155.209:https A / Padding
Ether / IP / TCP 172.64.155.209:https > 192.168.1.173:59176 PA / Raw
Ether / IP / TCP 192.168.1.173:59176 > 172.64.155.209:https A / Padding
Ether / IP / TCP 172.64.155.209:https > 192.168.1.173:59176 PA / Raw
Ether / IP / TCP 192.168.1.173:59176 > 172.64.155.209:https A / Padding
Ether / IP / TCP 192.168.1.173:59176 > 172.64.155.209:https PA / Raw
Ether / IP / TCP 192.168.1.173:59176 > 172.64.155.209:https PA / Raw
Ether / IP / TCP 192.168.1.173:59176 > 172.64.155.209:https PA / Raw
Ether / IP / TCP 192.168.1.173:59176 > 172.64.155.209:https PA / Raw
Ether / IP / TCP 172.64.155.209:https > 192.168.1.173:59176 A / Padding
Ether / IP / TCP 172.64.155.209:https > 192.168.1.173:59176 A / Padding
Ether / IP / TCP 172.64.155.209:https > 192.168.1.173:59176 A / Padding
Ether / IP / TCP 172.64.155.209:https > 192.168.1.173:59176 A / Padding
Ether / IP / TCP 172.64.155.209:https > 192.168.1.173:59176 A / Padding
Ether / IP / TCP 172.64.155.209:https > 192.168.1.173:59176 A / Padding
Ether / IP / TCP 172.64.155.209:https > 192.168.1.173:59176 A / Padding
Ether / IP / TCP 172.64.155.209:https > 192.168.1.173:59176 A / Padding
Ether / IP / TCP 172.64.155.209:https > 192.168.1.173:59176 A / Padding
Ether / IP / TCP 172.64.155.209:https > 192.168.1.173:59176 A / Padding
Ether / IP / TCP 172.64.155.209:https > 192.168.1.173:59176 A / Padding
Ether / IP / TCP 172.64.155.209:https > 192.168.1.173:59176 A / Padding
Ether / IP / TCP 172.64.155.209:https > 192.168.1.173:59176 PA / Raw
Ether / IP / TCP 172.64.155.209:https > 192.168.1.173:59176 PA / Raw
Ether / IP / TCP 192.168.1.173:59176 > 172.64.155.209:https A / Padding
Ether / IP / TCP 172.64.155.209:https > 192.168.1.173:59176 PA / Raw
Ether / IP / TCP 172.64.155.209:https > 192.168.1.173:59176 PA / Raw
Ether / IP / TCP 172.64.155.209:https > 192.168.1.173:59176 PA / Raw
Ether / IP / TCP 192.168.1.173:59176 > 172.64.155.209:https A / Padding
Ether / IP / TCP 172.64.155.209:https > 192.168.1.173:59176 PA / Raw
Ether / IP / TCP 192.168.1.173:59176 > 172.64.155.209:https A / Padding
Ether / IP / TCP 172.64.155.209:https > 192.168.1.173:59176 PA / Raw
Ether / IP / TCP 192.168.1.173:59176 > 172.64.155.209:https PA / Raw
Ether / IP / TCP 172.64.155.209:https > 192.168.1.173:59176 A / Padding
Ether / IP / TCP 172.64.155.209:https > 192.168.1.173:59176 PA / Raw
Ether / IP / TCP 192.168.1.173:59176 > 172.64.155.209:https A / Padding
Ether / IP / TCP 172.64.155.209:https > 192.168.1.173:59176 PA / Raw
Ether / IP / TCP 192.168.1.173:59176 > 172.64.155.209:https A / Padding
Ether / IP / TCP 172.64.155.209:https > 192.168.1.173:59176 PA / Raw
Ether / IP / TCP 192.168.1.173:59176 > 172.64.155.209:https A / Padding
Ether / IP / TCP 172.64.155.209:https > 192.168.1.173:59176 PA / Raw
Ether / IP / TCP 192.168.1.173:59176 > 172.64.155.209:https A / Padding
Ether / IP / TCP 172.64.155.209:https > 192.168.1.173:59176 PA / Raw
Ether / IP / TCP 192.168.1.173:59176 > 172.64.155.209:https A / Padding
Ether / IP / TCP 172.64.155.209:https > 192.168.1.173:59176 PA / Raw
Ether / IP / TCP 192.168.1.173:59176 > 172.64.155.209:https A / Padding
Ether / IP / TCP 172.64.155.209:https > 192.168.1.173:59176 PA / Raw
Ether / IP / TCP 192.168.1.173:59176 > 172.64.155.209:https A / Padding
Ether / IP / TCP 172.64.155.209:https > 192.168.1.173:59176 PA / Raw
Ether / IP / TCP 192.168.1.173:59176 > 172.64.155.209:https A / Padding
Ether / IP / TCP 172.64.155.209:https > 192.168.1.173:59176 PA / Raw
Ether / IP / TCP 192.168.1.1:domain > 192.168.1.173:59593 FA / Padding
Ether / IP / TCP 192.168.1.173:59593 > 192.168.1.1:domain A / Padding
Ether / IP / TCP 192.168.1.173:59176 > 172.64.155.209:https A / Padding
Ether / IP / TCP 192.168.1.173:59612 > 192.168.1.1:domain A / Raw / Padding
Ether / IP / TCP 192.168.1.1:domain > 192.168.1.173:59612 A / Padding
Ether / IP / TCP 192.168.1.173:59480 > 185.60.218.53:xmpp_client PA / Raw
Ether / IP / TCP 185.60.218.53:xmpp_client > 192.168.1.173:59480 A / Padding
Ether / IP / TCP 172.64.155.209:https > 192.168.1.173:59176 PA / Raw
Ether / IP / TCP 185.60.218.53:xmpp_client > 192.168.1.173:59480 PA / Raw
Ether / IP / TCP 192.168.1.173:59176 > 172.64.155.209:https A / Padding
Ether / IP / TCP 192.168.1.173:59480 > 185.60.218.53:xmpp_client A / Padding
Ether / IP / TCP 172.64.155.209:https > 192.168.1.173:59176 PA / Raw
Ether / IP / TCP 192.168.1.173:59176 > 172.64.155.209:https A / Padding
Ether / IP / TCP 172.64.155.209:https > 192.168.1.173:59176 PA / Raw
Ether / IP / TCP 192.168.1.173:59176 > 172.64.155.209:https A / Padding
Ether / IP / TCP 172.64.155.209:https > 192.168.1.173:59176 PA / Raw
Ether / IP / TCP 192.168.1.173:59176 > 172.64.155.209:https PA / Raw
Ether / IP / TCP 172.64.155.209:https > 192.168.1.173:59176 A / Padding
Ether / IP / TCP 172.64.155.209:https > 192.168.1.173:59176 PA / Raw
Ether / IP / TCP 192.168.1.173:59176 > 172.64.155.209:https A / Padding
Ether / IP / TCP 172.64.155.209:https > 192.168.1.173:59176 PA / Raw
Ether / IP / TCP 192.168.1.173:59176 > 172.64.155.209:https A / Padding
Ether / IP / TCP 172.64.155.209:https > 192.168.1.173:59176 PA / Raw
Ether / IP / TCP 192.168.1.173:59176 > 172.64.155.209:https A / Padding
Ether / IP / TCP 172.64.155.209:https > 192.168.1.173:59176 PA / Raw
Ether / IP / TCP 192.168.1.173:59176 > 172.64.155.209:https PA / Raw
Ether / IP / TCP 192.168.1.173:59176 > 172.64.155.209:https PA / Raw
Ether / IP / TCP 172.64.155.209:https > 192.168.1.173:59176 A / Padding
Ether / IP / TCP 172.64.155.209:https > 192.168.1.173:59176 A / Padding
Ether / IP / TCP 172.64.155.209:https > 192.168.1.173:59176 A / Padding
Ether / IP / TCP 172.64.155.209:https > 192.168.1.173:59176 A / Padding
Ether / IP / TCP 172.64.155.209:https > 192.168.1.173:59176 A / Padding
Ether / IP / TCP 172.64.155.209:https > 192.168.1.173:59176 A / Padding
Ether / IP / TCP 192.168.1.173:59176 > 172.64.155.209:https PA / Raw
Ether / IP / TCP 192.168.1.173:59176 > 172.64.155.209:https PA / Raw
Ether / IP / TCP 172.64.155.209:https > 192.168.1.173:59176 A / Padding
Ether / IP / TCP 172.64.155.209:https > 192.168.1.173:59176 A / Padding
Ether / IP / TCP 172.64.155.209:https > 192.168.1.173:59176 A / Padding
Ether / IP / TCP 172.64.155.209:https > 192.168.1.173:59176 A / Padding
Ether / IP / TCP 172.64.155.209:https > 192.168.1.173:59176 A / Padding
Ether / IP / TCP 172.64.155.209:https > 192.168.1.173:59176 A / Padding
Ether / IP / TCP 172.64.155.209:https > 192.168.1.173:59176 PA / Raw
Ether / IP / TCP 172.64.155.209:https > 192.168.1.173:59176 PA / Raw
Ether / IP / TCP 192.168.1.173:59176 > 172.64.155.209:https A / Padding
Ether / IP / TCP 172.64.155.209:https > 192.168.1.173:59176 PA / Raw
Ether / IP / TCP 172.64.155.209:https > 192.168.1.173:59176 PA / Raw
Ether / IP / TCP 172.64.155.209:https > 192.168.1.173:59176 PA / Raw
Ether / IP / TCP 192.168.1.173:59176 > 172.64.155.209:https A / Padding
Ether / IP / TCP 172.64.155.209:https > 192.168.1.173:59176 PA / Raw
Ether / IP / TCP 172.64.155.209:https > 192.168.1.173:59176 PA / Raw
Ether / IP / TCP 192.168.1.173:59176 > 172.64.155.209:https A / Padding
Ether / IP / TCP 172.64.155.209:https > 192.168.1.173:59176 PA / Raw
Ether / IP / TCP 192.168.1.173:59176 > 172.64.155.209:https A / Padding
Ether / IP / TCP 192.168.1.173:59621 > 192.168.1.1:domain A / Raw / Padding
Ether / IP / TCP 192.168.1.1:domain > 192.168.1.173:59621 A / Padding
Ether / IP / TCP 192.168.1.173:59393 > 185.199.110.133:https A / Raw / Padding
Ether / IP / TCP 185.199.110.133:https > 192.168.1.173:59393 A
Ether / IP / TCP 192.168.1.173:59524 > 140.82.113.25:https A / Raw / Padding
Ether / IP / TCP 140.82.113.25:https > 192.168.1.173:59524 A
Ether / IP / TCP 192.168.1.173:59305 > 213.180.193.234:https A / Raw / Padding
Ether / IP / TCP 213.180.193.234:https > 192.168.1.173:59305 A
Ether / IP / TCP 192.168.1.173:59638 > 52.123.128.14:https S
Ether / IP / TCP 52.123.128.14:https > 192.168.1.173:59638 SA
Ether / IP / TCP 192.168.1.173:59638 > 52.123.128.14:https A / Padding
Ether / IP / TCP 192.168.1.173:59638 > 52.123.128.14:https PA / Raw
Ether / IP / TCP 52.123.128.14:https > 192.168.1.173:59638 A / Padding
Ether / IP / TCP 52.123.128.14:https > 192.168.1.173:59638 A / Raw
Ether / IP / TCP 192.168.1.173:59638 > 52.123.128.14:https A / Padding
Ether / IP / TCP 52.123.128.14:https > 192.168.1.173:59638 A / Raw
Ether / IP / TCP 52.123.128.14:https > 192.168.1.173:59638 A / Raw
Ether / IP / TCP 52.123.128.14:https > 192.168.1.173:59638 PA / Raw
Ether / IP / TCP 192.168.1.173:59638 > 52.123.128.14:https A / Padding
Ether / IP / TCP 192.168.1.173:59638 > 52.123.128.14:https PA / Raw
Ether / IP / TCP 52.123.128.14:https > 192.168.1.173:59638 A / Padding
Ether / IP / TCP 52.123.128.14:https > 192.168.1.173:59638 PA / Raw
Ether / IP / TCP 52.123.128.14:https > 192.168.1.173:59638 PA / Raw
Ether / IP / TCP 192.168.1.173:59638 > 52.123.128.14:https A / Padding
Ether / IP / TCP 192.168.1.173:59638 > 52.123.128.14:https PA / Raw
Ether / IP / TCP 192.168.1.173:59638 > 52.123.128.14:https PA / Raw
Ether / IP / TCP 192.168.1.173:59638 > 52.123.128.14:https PA / Raw
Ether / IP / TCP 52.123.128.14:https > 192.168.1.173:59638 A / Padding
Ether / IP / TCP 52.123.128.14:https > 192.168.1.173:59638 PA / Raw
Ether / IP / TCP 52.123.128.14:https > 192.168.1.173:59638 A / Padding
Ether / IP / TCP 192.168.1.173:59638 > 52.123.128.14:https A / Padding
Ether / IP / TCP 52.123.128.14:https > 192.168.1.173:59638 A / Raw
Ether / IP / TCP 52.123.128.14:https > 192.168.1.173:59638 PA / Raw
Ether / IP / TCP 192.168.1.173:59638 > 52.123.128.14:https A / Padding
Ether / IP / TCP 192.168.1.173:59638 > 52.123.128.14:https A / Padding
Ether / IP / TCP 52.123.128.14:https > 192.168.1.173:59638 A / Raw
Ether / IP / TCP 192.168.1.173:59638 > 52.123.128.14:https A / Padding
Ether / IP / TCP 52.123.128.14:https > 192.168.1.173:59638 A / Raw
Ether / IP / TCP 52.123.128.14:https > 192.168.1.173:59638 A / Raw
Ether / IP / TCP 52.123.128.14:https > 192.168.1.173:59638 PA / Raw
Ether / IP / TCP 192.168.1.173:59638 > 52.123.128.14:https A / Padding
Ether / IP / TCP 52.123.128.14:https > 192.168.1.173:59638 A / Raw
Ether / IP / TCP 52.123.128.14:https > 192.168.1.173:59638 PA / Raw
Ether / IP / TCP 192.168.1.173:59638 > 52.123.128.14:https A / Padding
Ether / IP / TCP 52.123.128.14:https > 192.168.1.173:59638 A / Raw
Ether / IP / TCP 192.168.1.173:59638 > 52.123.128.14:https A / Padding
Ether / IP / TCP 52.123.128.14:https > 192.168.1.173:59638 A / Raw
Ether / IP / TCP 192.168.1.173:59638 > 52.123.128.14:https A / Padding
Ether / IP / TCP 52.123.128.14:https > 192.168.1.173:59638 A / Raw
Ether / IP / TCP 52.123.128.14:https > 192.168.1.173:59638 A / Raw
Ether / IP / TCP 52.123.128.14:https > 192.168.1.173:59638 PA / Raw
Ether / IP / TCP 192.168.1.173:59638 > 52.123.128.14:https A / Padding
Ether / IP / TCP 52.123.128.14:https > 192.168.1.173:59638 A / Raw
Ether / IP / TCP 192.168.1.173:59638 > 52.123.128.14:https A / Padding
Ether / IP / TCP 52.123.128.14:https > 192.168.1.173:59638 A / Raw
Ether / IP / TCP 52.123.128.14:https > 192.168.1.173:59638 A / Raw
Ether / IP / TCP 192.168.1.173:59638 > 52.123.128.14:https A / Padding
Ether / IP / TCP 52.123.128.14:https > 192.168.1.173:59638 A / Raw
Ether / IP / TCP 52.123.128.14:https > 192.168.1.173:59638 A / Raw
Ether / IP / TCP 52.123.128.14:https > 192.168.1.173:59638 PA / Raw
Ether / IP / TCP 192.168.1.173:59638 > 52.123.128.14:https A / Padding
Ether / IP / TCP 52.123.128.14:https > 192.168.1.173:59638 A / Raw
Ether / IP / TCP 192.168.1.173:59638 > 52.123.128.14:https A / Padding
Ether / IP / TCP 52.123.128.14:https > 192.168.1.173:59638 A / Raw
Ether / IP / TCP 52.123.128.14:https > 192.168.1.173:59638 A / Raw
Ether / IP / TCP 192.168.1.173:59638 > 52.123.128.14:https A / Padding
Ether / IP / TCP 52.123.128.14:https > 192.168.1.173:59638 A / Raw
Ether / IP / TCP 52.123.128.14:https > 192.168.1.173:59638 A / Raw
Ether / IP / TCP 52.123.128.14:https > 192.168.1.173:59638 PA / Raw
Ether / IP / TCP 192.168.1.173:59638 > 52.123.128.14:https A / Padding
Ether / IP / TCP 52.123.128.14:https > 192.168.1.173:59638 A / Raw
Ether / IP / TCP 52.123.128.14:https > 192.168.1.173:59638 PA / Raw
Ether / IP / TCP 192.168.1.173:59638 > 52.123.128.14:https A / Padding
Ether / IP / TCP 192.168.1.173:59177 > 104.18.32.47:https PA / Raw
Ether / IP / TCP 192.168.1.173:59177 > 104.18.32.47:https PA / Raw
Ether / IP / TCP 104.18.32.47:https > 192.168.1.173:59177 A / Padding
Ether / IP / TCP 104.18.32.47:https > 192.168.1.173:59177 A / Padding
Ether / IP / TCP 104.18.32.47:https > 192.168.1.173:59177 PA / Raw
Ether / IP / TCP 104.18.32.47:https > 192.168.1.173:59177 PA / Raw
Ether / IP / TCP 104.18.32.47:https > 192.168.1.173:59177 PA / Raw
Ether / IP / TCP 192.168.1.173:59177 > 104.18.32.47:https A / Padding
Ether / IP / TCP 192.168.1.173:59177 > 104.18.32.47:https PA / Raw
Ether / IP / TCP 104.18.32.47:https > 192.168.1.173:59177 A / Padding
Ether / IP / TCP 192.168.1.173:59176 > 172.64.155.209:https PA / Raw
Ether / IP / TCP 192.168.1.173:59176 > 172.64.155.209:https PA / Raw
Ether / IP / TCP 172.64.155.209:https > 192.168.1.173:59176 A / Padding
Ether / IP / TCP 172.64.155.209:https > 192.168.1.173:59176 A / Padding
Ether / IP / TCP 172.64.155.209:https > 192.168.1.173:59176 A / Padding
Ether / IP / TCP 172.64.155.209:https > 192.168.1.173:59176 A / Padding
Ether / IP / TCP 172.64.155.209:https > 192.168.1.173:59176 A / Padding
Ether / IP / TCP 172.64.155.209:https > 192.168.1.173:59176 A / Padding
Ether / IP / TCP 172.64.155.209:https > 192.168.1.173:59176 PA / Raw
Ether / IP / TCP 172.64.155.209:https > 192.168.1.173:59176 PA / Raw
Ether / IP / TCP 192.168.1.173:59176 > 172.64.155.209:https A / Padding
Ether / IP / TCP 172.64.155.209:https > 192.168.1.173:59176 A / Raw
Ether / IP / TCP 192.168.1.173:59176 > 172.64.155.209:https A / Padding
Ether / IP / TCP 172.64.155.209:https > 192.168.1.173:59176 A / Raw
Ether / IP / TCP 192.168.1.173:59176 > 172.64.155.209:https A / Padding
Ether / IP / TCP 192.168.1.173:59176 > 172.64.155.209:https PA / Raw
Ether / IP / TCP 192.168.1.173:59176 > 172.64.155.209:https A / Padding
Ether / IP / TCP 172.64.155.209:https > 192.168.1.173:59176 A / Raw
Ether / IP / TCP 192.168.1.173:59176 > 172.64.155.209:https A / Padding
Ether / IP / TCP 172.64.155.209:https > 192.168.1.173:59176 A / Raw
Ether / IP / TCP 192.168.1.173:59176 > 172.64.155.209:https A / Padding
Ether / IP / TCP 172.64.155.209:https > 192.168.1.173:59176 A / Raw
Ether / IP / TCP 172.64.155.209:https > 192.168.1.173:59176 PA / Raw
Ether / IP / TCP 172.64.155.209:https > 192.168.1.173:59176 PA / Raw
Ether / IP / TCP 192.168.1.173:59176 > 172.64.155.209:https A / Padding
Ether / IP / TCP 172.64.155.209:https > 192.168.1.173:59176 A / Padding
Ether / IP / TCP 192.168.1.173:59176 > 172.64.155.209:https PA / Raw
Ether / IP / TCP 192.168.1.173:59176 > 172.64.155.209:https PA / Raw
Ether / IP / TCP 192.168.1.173:59176 > 172.64.155.209:https PA / Raw
Ether / IP / TCP 192.168.1.173:59176 > 172.64.155.209:https PA / Raw
Ether / IP / TCP 172.64.155.209:https > 192.168.1.173:59176 A / Padding
Ether / IP / TCP 172.64.155.209:https > 192.168.1.173:59176 A / Padding
Ether / IP / TCP 172.64.155.209:https > 192.168.1.173:59176 A / Padding
Ether / IP / TCP 172.64.155.209:https > 192.168.1.173:59176 A / Padding
Ether / IP / TCP 172.64.155.209:https > 192.168.1.173:59176 A / Padding
Ether / IP / TCP 172.64.155.209:https > 192.168.1.173:59176 A / Padding
Ether / IP / TCP 172.64.155.209:https > 192.168.1.173:59176 A / Padding
Ether / IP / TCP 172.64.155.209:https > 192.168.1.173:59176 A / Padding
Ether / IP / TCP 172.64.155.209:https > 192.168.1.173:59176 A / Padding
Ether / IP / TCP 172.64.155.209:https > 192.168.1.173:59176 A / Padding
Ether / IP / TCP 172.64.155.209:https > 192.168.1.173:59176 A / Padding
Ether / IP / TCP 172.64.155.209:https > 192.168.1.173:59176 PA / Raw
Ether / IP / TCP 172.64.155.209:https > 192.168.1.173:59176 PA / Raw
Ether / IP / TCP 172.64.155.209:https > 192.168.1.173:59176 PA / Raw
Ether / IP / TCP 192.168.1.173:59176 > 172.64.155.209:https A / Padding
Ether / IP / TCP 172.64.155.209:https > 192.168.1.173:59176 PA / Raw
Ether / IP / TCP 172.64.155.209:https > 192.168.1.173:59176 PA / Raw
Ether / IP / TCP 192.168.1.173:59176 > 172.64.155.209:https A / Padding
Ether / IP / TCP 172.64.155.209:https > 192.168.1.173:59176 PA / Raw
Ether / IP / TCP 172.64.155.209:https > 192.168.1.173:59176 PA / Raw
Ether / IP / TCP 192.168.1.173:59176 > 172.64.155.209:https A / Padding
Ether / IP / TCP 192.168.1.173:59176 > 172.64.155.209:https PA / Raw
Ether / IP / TCP 192.168.1.173:59176 > 172.64.155.209:https PA / Raw
Ether / IP / TCP 192.168.1.173:59176 > 172.64.155.209:https PA / Raw
Ether / IP / TCP 192.168.1.173:59176 > 172.64.155.209:https PA / Raw
Ether / IP / TCP 172.64.155.209:https > 192.168.1.173:59176 A / Padding
Ether / IP / TCP 172.64.155.209:https > 192.168.1.173:59176 A / Padding
Ether / IP / TCP 172.64.155.209:https > 192.168.1.173:59176 A / Padding
Ether / IP / TCP 172.64.155.209:https > 192.168.1.173:59176 A / Padding
Ether / IP / TCP 172.64.155.209:https > 192.168.1.173:59176 A / Padding
Ether / IP / TCP 172.64.155.209:https > 192.168.1.173:59176 A / Padding
Ether / IP / TCP 172.64.155.209:https > 192.168.1.173:59176 A / Padding
Ether / IP / TCP 172.64.155.209:https > 192.168.1.173:59176 A / Padding
Ether / IP / TCP 172.64.155.209:https > 192.168.1.173:59176 A / Padding
Ether / IP / TCP 172.64.155.209:https > 192.168.1.173:59176 A / Padding
Ether / IP / TCP 172.64.155.209:https > 192.168.1.173:59176 A / Padding
Ether / IP / TCP 172.64.155.209:https > 192.168.1.173:59176 A / Padding
Ether / IP / TCP 172.64.155.209:https > 192.168.1.173:59176 PA / Raw
Ether / IP / TCP 172.64.155.209:https > 192.168.1.173:59176 PA / Raw
Ether / IP / TCP 192.168.1.173:59176 > 172.64.155.209:https A / Padding
Ether / IP / TCP 172.64.155.209:https > 192.168.1.173:59176 PA / Raw
Ether / IP / TCP 172.64.155.209:https > 192.168.1.173:59176 PA / Raw
Ether / IP / TCP 172.64.155.209:https > 192.168.1.173:59176 PA / Raw
Ether / IP / TCP 192.168.1.173:59176 > 172.64.155.209:https A / Padding
Ether / IP / TCP 192.168.1.173:59176 > 172.64.155.209:https PA / Raw
Ether / IP / TCP 192.168.1.173:59176 > 172.64.155.209:https PA / Raw
Ether / IP / TCP 192.168.1.173:59176 > 172.64.155.209:https PA / Raw
Ether / IP / TCP 192.168.1.173:59176 > 172.64.155.209:https PA / Raw
Ether / IP / TCP 172.64.155.209:https > 192.168.1.173:59176 A / Padding
Ether / IP / TCP 172.64.155.209:https > 192.168.1.173:59176 A / Padding
Ether / IP / TCP 172.64.155.209:https > 192.168.1.173:59176 A / Padding
Ether / IP / TCP 172.64.155.209:https > 192.168.1.173:59176 A / Padding
Ether / IP / TCP 172.64.155.209:https > 192.168.1.173:59176 A / Padding
Ether / IP / TCP 172.64.155.209:https > 192.168.1.173:59176 A / Padding
Ether / IP / TCP 172.64.155.209:https > 192.168.1.173:59176 A / Padding
Ether / IP / TCP 172.64.155.209:https > 192.168.1.173:59176 A / Padding
Ether / IP / TCP 172.64.155.209:https > 192.168.1.173:59176 A / Padding
Ether / IP / TCP 172.64.155.209:https > 192.168.1.173:59176 A / Padding
Ether / IP / TCP 172.64.155.209:https > 192.168.1.173:59176 A / Padding
Ether / IP / TCP 172.64.155.209:https > 192.168.1.173:59176 PA / Raw
Ether / IP / TCP 172.64.155.209:https > 192.168.1.173:59176 PA / Raw
Ether / IP / TCP 172.64.155.209:https > 192.168.1.173:59176 PA / Raw
Ether / IP / TCP 192.168.1.173:59176 > 172.64.155.209:https A / Padding
Ether / IP / TCP 172.64.155.209:https > 192.168.1.173:59176 PA / Raw
Ether / IP / TCP 172.64.155.209:https > 192.168.1.173:59176 PA / Raw
Ether / IP / TCP 172.64.155.209:https > 192.168.1.173:59176 PA / Raw
Ether / IP / TCP 192.168.1.173:59176 > 172.64.155.209:https A / Padding
Ether / IP / TCP 192.168.1.173:58101 > 213.180.204.179:https A / Raw / Padding
Ether / IP / TCP 213.180.204.179:https > 192.168.1.173:58101 A
Ether / IP / TCP 192.168.1.173:59176 > 172.64.155.209:https PA / Raw
Ether / IP / TCP 192.168.1.173:59176 > 172.64.155.209:https PA / Raw
Ether / IP / TCP 192.168.1.173:59176 > 172.64.155.209:https PA / Raw
Ether / IP / TCP 192.168.1.173:59176 > 172.64.155.209:https PA / Raw
Ether / IP / TCP 172.64.155.209:https > 192.168.1.173:59176 A / Padding
Ether / IP / TCP 172.64.155.209:https > 192.168.1.173:59176 A / Padding
Ether / IP / TCP 172.64.155.209:https > 192.168.1.173:59176 A / Padding
Ether / IP / TCP 172.64.155.209:https > 192.168.1.173:59176 A / Padding
Ether / IP / TCP 172.64.155.209:https > 192.168.1.173:59176 A / Padding
Ether / IP / TCP 172.64.155.209:https > 192.168.1.173:59176 A / Padding
Ether / IP / TCP 172.64.155.209:https > 192.168.1.173:59176 A / Padding
Ether / IP / TCP 172.64.155.209:https > 192.168.1.173:59176 A / Padding
Ether / IP / TCP 172.64.155.209:https > 192.168.1.173:59176 A / Padding
Ether / IP / TCP 172.64.155.209:https > 192.168.1.173:59176 A / Padding
Ether / IP / TCP 172.64.155.209:https > 192.168.1.173:59176 A / Padding
Ether / IP / TCP 172.64.155.209:https > 192.168.1.173:59176 PA / Raw
Ether / IP / TCP 172.64.155.209:https > 192.168.1.173:59176 PA / Raw
Ether / IP / TCP 172.64.155.209:https > 192.168.1.173:59176 PA / Raw
Ether / IP / TCP 192.168.1.173:59176 > 172.64.155.209:https A / Padding
Ether / IP / TCP 192.168.1.173:59176 > 172.64.155.209:https PA / Raw
Ether / IP / TCP 172.64.155.209:https > 192.168.1.173:59176 A / Padding
Ether / IP / TCP 172.64.155.209:https > 192.168.1.173:59176 PA / Raw
Ether / IP / TCP 172.64.155.209:https > 192.168.1.173:59176 PA / Raw
Ether / IP / TCP 172.64.155.209:https > 192.168.1.173:59176 PA / Raw
Ether / IP / TCP 172.64.155.209:https > 192.168.1.173:59176 PA / Raw
Ether / IP / TCP 192.168.1.173:59176 > 172.64.155.209:https A / Padding
Ether / IP / TCP 192.168.1.173:59176 > 172.64.155.209:https PA / Raw
Ether / IP / TCP 192.168.1.173:59176 > 172.64.155.209:https PA / Raw
Ether / IP / TCP 192.168.1.173:59176 > 172.64.155.209:https PA / Raw
Ether / IP / TCP 192.168.1.173:59176 > 172.64.155.209:https PA / Raw
Ether / IP / TCP 172.64.155.209:https > 192.168.1.173:59176 A
Ether / IP / TCP 172.64.155.209:https > 192.168.1.173:59176 A
Ether / IP / TCP 172.64.155.209:https > 192.168.1.173:59176 A
Ether / IP / TCP 172.64.155.209:https > 192.168.1.173:59176 A
Ether / IP / TCP 172.64.155.209:https > 192.168.1.173:59176 A
Ether / IP / TCP 172.64.155.209:https > 192.168.1.173:59176 A
Ether / IP / TCP 192.168.1.173:59176 > 172.64.155.209:https PA / Raw
Ether / IP / TCP 172.64.155.209:https > 192.168.1.173:59176 A
Ether / IP / TCP 172.64.155.209:https > 192.168.1.173:59176 A
Ether / IP / TCP 172.64.155.209:https > 192.168.1.173:59176 A
Ether / IP / TCP 172.64.155.209:https > 192.168.1.173:59176 A
Ether / IP / TCP 172.64.155.209:https > 192.168.1.173:59176 A / Padding
Ether / IP / TCP 172.64.155.209:https > 192.168.1.173:59176 PA / Raw
Ether / IP / TCP 172.64.155.209:https > 192.168.1.173:59176 PA / Raw
Ether / IP / TCP 192.168.1.173:59176 > 172.64.155.209:https A / Padding
Ether / IP / TCP 172.64.155.209:https > 192.168.1.173:59176 PA / Raw
Ether / IP / TCP 172.64.155.209:https > 192.168.1.173:59176 PA / Raw
Ether / IP / TCP 172.64.155.209:https > 192.168.1.173:59176 PA / Raw
Ether / IP / TCP 192.168.1.173:59176 > 172.64.155.209:https A / Padding
Ether / IP / TCP 192.168.1.173:59177 > 104.18.32.47:https PA / Raw
Ether / IP / TCP 192.168.1.173:59177 > 104.18.32.47:https PA / Raw
Ether / IP / TCP 104.18.32.47:https > 192.168.1.173:59177 A / Padding
Ether / IP / TCP 104.18.32.47:https > 192.168.1.173:59177 A / Padding
Ether / IP / TCP 104.18.32.47:https > 192.168.1.173:59177 PA / Raw
Ether / IP / TCP 104.18.32.47:https > 192.168.1.173:59177 PA / Raw
Ether / IP / TCP 192.168.1.173:59177 > 104.18.32.47:https A / Padding
Ether / IP / TCP 192.168.1.173:59177 > 104.18.32.47:https PA / Raw
Ether / IP / TCP 104.18.32.47:https > 192.168.1.173:59177 A / Padding
Ether / IP / TCP 192.168.1.173:59614 > 192.168.1.1:domain A / Raw / Padding
Ether / IP / TCP 192.168.1.1:domain > 192.168.1.173:59614 A / Padding
Ether / IP / TCP 192.168.1.173:59630 > 35.190.80.1:https A / Raw / Padding
Ether / IP / TCP 35.190.80.1:https > 192.168.1.173:59630 A
Ether / IP / TCP 192.168.1.173:59176 > 172.64.155.209:https PA / Raw
Ether / IP / TCP 192.168.1.173:59176 > 172.64.155.209:https PA / Raw
Ether / IP / TCP 192.168.1.173:59176 > 172.64.155.209:https PA / Raw
Ether / IP / TCP 192.168.1.173:59176 > 172.64.155.209:https PA / Raw
Ether / IP / TCP 172.64.155.209:https > 192.168.1.173:59176 A / Padding
Ether / IP / TCP 172.64.155.209:https > 192.168.1.173:59176 A / Padding
Ether / IP / TCP 172.64.155.209:https > 192.168.1.173:59176 A / Padding
Ether / IP / TCP 172.64.155.209:https > 192.168.1.173:59176 A / Padding
Ether / IP / TCP 172.64.155.209:https > 192.168.1.173:59176 A / Padding
Ether / IP / TCP 172.64.155.209:https > 192.168.1.173:59176 A / Padding
Ether / IP / TCP 172.64.155.209:https > 192.168.1.173:59176 A / Padding
Ether / IP / TCP 172.64.155.209:https > 192.168.1.173:59176 A / Padding
Ether / IP / TCP 172.64.155.209:https > 192.168.1.173:59176 A / Padding
Ether / IP / TCP 172.64.155.209:https > 192.168.1.173:59176 A / Padding
Ether / IP / TCP 172.64.155.209:https > 192.168.1.173:59176 A / Padding
Ether / IP / TCP 172.64.155.209:https > 192.168.1.173:59176 PA / Raw
Ether / IP / TCP 172.64.155.209:https > 192.168.1.173:59176 PA / Raw
Ether / IP / TCP 172.64.155.209:https > 192.168.1.173:59176 PA / Raw
Ether / IP / TCP 192.168.1.173:59176 > 172.64.155.209:https A / Padding
Ether / IP / TCP 172.64.155.209:https > 192.168.1.173:59176 PA / Raw
Ether / IP / TCP 172.64.155.209:https > 192.168.1.173:59176 PA / Raw
Ether / IP / TCP 172.64.155.209:https > 192.168.1.173:59176 PA / Raw
Ether / IP / TCP 192.168.1.173:59176 > 172.64.155.209:https A / Padding
Ether / IP / TCP 172.64.155.209:https > 192.168.1.173:59176 PA / Raw
Ether / IP / TCP 192.168.1.173:59176 > 172.64.155.209:https A
Ether / IP / TCP 192.168.1.173:59176 > 172.64.155.209:https PA / Raw
Ether / IP / TCP 192.168.1.173:59176 > 172.64.155.209:https PA / Raw
Ether / IP / TCP 172.64.155.209:https > 192.168.1.173:59176 A / Padding
Ether / IP / TCP 172.64.155.209:https > 192.168.1.173:59176 A / Padding
Ether / IP / TCP 172.64.155.209:https > 192.168.1.173:59176 A / Padding
Ether / IP / TCP 172.64.155.209:https > 192.168.1.173:59176 A / Padding
Ether / IP / TCP 172.64.155.209:https > 192.168.1.173:59176 A / Padding
Ether / IP / TCP 172.64.155.209:https > 192.168.1.173:59176 A / Padding
Ether / IP / TCP 172.64.155.209:https > 192.168.1.173:59176 A / Padding
Ether / IP / TCP 172.64.155.209:https > 192.168.1.173:59176 A / Padding
Ether / IP / TCP 172.64.155.209:https > 192.168.1.173:59176 A / Padding
Ether / IP / TCP 172.64.155.209:https > 192.168.1.173:59176 PA / Raw
Ether / IP / TCP 172.64.155.209:https > 192.168.1.173:59176 PA / Raw
Ether / IP / TCP 172.64.155.209:https > 192.168.1.173:59176 PA / Raw
Ether / IP / TCP 192.168.1.173:59176 > 172.64.155.209:https A / Padding
Ether / IP / TCP 192.168.1.173:59176 > 172.64.155.209:https PA / Raw
Ether / IP / TCP 172.64.155.209:https > 192.168.1.173:59176 A / Padding
Ether / IP / TCP 172.64.155.209:https > 192.168.1.173:59176 PA / Raw
Ether / IP / TCP 140.82.113.25:https > 192.168.1.173:59524 PA / Raw
Ether / IP / TCP 192.168.1.173:59524 > 140.82.113.25:https PA / Raw
Ether / IP / TCP 192.168.1.173:59176 > 172.64.155.209:https A / Padding
Ether / IP / TCP 172.64.155.209:https > 192.168.1.173:59176 PA / Raw
Ether / IP / TCP 192.168.1.173:59176 > 172.64.155.209:https A / Padding
Ether / IP / TCP 140.82.113.25:https > 192.168.1.173:59524 A / Padding
Ether / IP / TCP 172.64.155.209:https > 192.168.1.173:59176 PA / Raw
Ether / IP / TCP 192.168.1.173:59176 > 172.64.155.209:https A / Padding
Ether / IP / TCP 192.168.1.173:59176 > 172.64.155.209:https PA / Raw
Ether / IP / TCP 192.168.1.173:59176 > 172.64.155.209:https PA / Raw
Ether / IP / TCP 192.168.1.173:59176 > 172.64.155.209:https PA / Raw
Ether / IP / TCP 192.168.1.173:59176 > 172.64.155.209:https PA / Raw
Ether / IP / TCP 172.64.155.209:https > 192.168.1.173:59176 PA / Raw
Ether / IP / TCP 172.64.155.209:https > 192.168.1.173:59176 A / Padding
Ether / IP / TCP 172.64.155.209:https > 192.168.1.173:59176 A / Padding
Ether / IP / TCP 172.64.155.209:https > 192.168.1.173:59176 A / Padding
Ether / IP / TCP 172.64.155.209:https > 192.168.1.173:59176 A / Padding
Ether / IP / TCP 172.64.155.209:https > 192.168.1.173:59176 A / Padding
Ether / IP / TCP 172.64.155.209:https > 192.168.1.173:59176 A / Padding
Ether / IP / TCP 172.64.155.209:https > 192.168.1.173:59176 A / Padding
Ether / IP / TCP 172.64.155.209:https > 192.168.1.173:59176 A / Padding
Ether / IP / TCP 172.64.155.209:https > 192.168.1.173:59176 A / Padding
Ether / IP / TCP 172.64.155.209:https > 192.168.1.173:59176 A / Padding
Ether / IP / TCP 172.64.155.209:https > 192.168.1.173:59176 A / Padding
Ether / IP / TCP 192.168.1.173:59176 > 172.64.155.209:https A / Padding
Ether / IP / TCP 172.64.155.209:https > 192.168.1.173:59176 PA / Raw
Ether / IP / TCP 172.64.155.209:https > 192.168.1.173:59176 PA / Raw
Ether / IP / TCP 172.64.155.209:https > 192.168.1.173:59176 PA / Raw
Ether / IP / TCP 192.168.1.173:59176 > 172.64.155.209:https A / Padding
Ether / IP / TCP 172.64.155.209:https > 192.168.1.173:59176 PA / Raw
Ether / IP / TCP 192.168.1.173:59176 > 172.64.155.209:https A / Padding
Ether / IP / TCP 172.64.155.209:https > 192.168.1.173:59176 PA / Raw
Ether / IP / TCP 172.64.155.209:https > 192.168.1.173:59176 PA / Raw
Ether / IP / TCP 192.168.1.173:59176 > 172.64.155.209:https A / Padding
Ether / IP / TCP 172.64.155.209:https > 192.168.1.173:59176 PA / Raw
Ether / IP / TCP 192.168.1.173:59176 > 172.64.155.209:https A / Padding
Ether / IP / TCP 172.64.155.209:https > 192.168.1.173:59176 PA / Raw
Ether / IP / TCP 192.168.1.173:59176 > 172.64.155.209:https A / Padding
Ether / IP / TCP 172.64.155.209:https > 192.168.1.173:59176 PA / Raw
Ether / IP / TCP 192.168.1.173:59176 > 172.64.155.209:https A / Padding
Ether / IP / TCP 172.64.155.209:https > 192.168.1.173:59176 PA / Raw
Ether / IP / TCP 192.168.1.173:59176 > 172.64.155.209:https A / Padding
Ether / IP / TCP 172.64.155.209:https > 192.168.1.173:59176 PA / Raw
Ether / IP / TCP 192.168.1.173:59176 > 172.64.155.209:https A / Padding
Ether / IP / TCP 172.64.155.209:https > 192.168.1.173:59176 PA / Raw
Ether / IP / TCP 192.168.1.173:59176 > 172.64.155.209:https A / Padding
Ether / IP / TCP 172.64.155.209:https > 192.168.1.173:59176 PA / Raw
Ether / IP / TCP 192.168.1.173:59176 > 172.64.155.209:https A / Padding
Ether / IP / TCP 172.64.155.209:https > 192.168.1.173:59176 PA / Raw
Ether / IP / TCP 192.168.1.173:59176 > 172.64.155.209:https PA / Raw
Ether / IP / TCP 192.168.1.173:59176 > 172.64.155.209:https PA / Raw
Ether / IP / TCP 172.64.155.209:https > 192.168.1.173:59176 A / Padding
Ether / IP / TCP 172.64.155.209:https > 192.168.1.173:59176 A / Padding
Ether / IP / TCP 172.64.155.209:https > 192.168.1.173:59176 A / Padding
Ether / IP / TCP 172.64.155.209:https > 192.168.1.173:59176 A / Padding
Ether / IP / TCP 172.64.155.209:https > 192.168.1.173:59176 A / Padding
Ether / IP / TCP 172.64.155.209:https > 192.168.1.173:59176 A / Padding
Ether / IP / TCP 192.168.1.173:59176 > 172.64.155.209:https PA / Raw
Ether / IP / TCP 192.168.1.173:59176 > 172.64.155.209:https PA / Raw
Ether / IP / TCP 172.64.155.209:https > 192.168.1.173:59176 A
Ether / IP / TCP 172.64.155.209:https > 192.168.1.173:59176 A
Ether / IP / TCP 172.64.155.209:https > 192.168.1.173:59176 A
Ether / IP / TCP 192.168.1.173:59176 > 172.64.155.209:https A / Raw
Ether / IP / TCP 172.64.155.209:https > 192.168.1.173:59176 A
Ether / IP / TCP 172.64.155.209:https > 192.168.1.173:59176 A / Padding
Ether / IP / TCP 172.64.155.209:https > 192.168.1.173:59176 PA / Raw
Ether / IP / TCP 172.64.155.209:https > 192.168.1.173:59176 PA / Raw
Ether / IP / TCP 192.168.1.173:59176 > 172.64.155.209:https A / Padding
Ether / IP / TCP 172.64.155.209:https > 192.168.1.173:59176 PA / Raw
Ether / IP / TCP 172.64.155.209:https > 192.168.1.173:59176 PA / Raw
Ether / IP / TCP 172.64.155.209:https > 192.168.1.173:59176 PA / Raw
Ether / IP / TCP 172.64.155.209:https > 192.168.1.173:59176 PA / Raw
Ether / IP / TCP 192.168.1.173:59176 > 172.64.155.209:https A / Padding
Ether / IP / TCP 172.64.155.209:https > 192.168.1.173:59176 PA / Raw
Ether / IP / TCP 172.64.155.209:https > 192.168.1.173:59176 PA / Raw
Ether / IP / TCP 192.168.1.173:59176 > 172.64.155.209:https A / Padding
Ether / IP / TCP 172.64.155.209:https > 192.168.1.173:59176 PA / Raw
Ether / IP / TCP 192.168.1.173:59176 > 172.64.155.209:https A / Padding
Ether / IP / TCP 192.168.1.173:59576 > 3.233.158.24:https A / Raw / Padding
Ether / IP / TCP 3.233.158.24:https > 192.168.1.173:59576 A
Ether / IP / TCP 192.168.1.173:59177 > 104.18.32.47:https PA / Raw
Ether / IP / TCP 192.168.1.173:59177 > 104.18.32.47:https PA / Raw
Ether / IP / TCP 104.18.32.47:https > 192.168.1.173:59177 A / Padding
Ether / IP / TCP 104.18.32.47:https > 192.168.1.173:59177 A / Padding
Ether / IP / TCP 104.18.32.47:https > 192.168.1.173:59177 PA / Raw
Ether / IP / TCP 104.18.32.47:https > 192.168.1.173:59177 PA / Raw
Ether / IP / TCP 104.18.32.47:https > 192.168.1.173:59177 PA / Raw
Ether / IP / TCP 192.168.1.173:59177 > 104.18.32.47:https A / Padding
Ether / IP / TCP 192.168.1.173:59177 > 104.18.32.47:https PA / Raw
Ether / IP / TCP 104.18.32.47:https > 192.168.1.173:59177 A / Padding
Ether / IP / TCP 192.168.1.173:59644 > 213.180.193.232:https S
Ether / IP / TCP 213.180.193.232:https > 192.168.1.173:59644 SA
Ether / IP / TCP 192.168.1.173:59644 > 213.180.193.232:https A / Padding
Ether / IP / TCP 192.168.1.173:59644 > 213.180.193.232:https PA / Raw
Ether / IP / TCP 213.180.193.232:https > 192.168.1.173:59644 A / Padding
Ether / IP / TCP 213.180.193.232:https > 192.168.1.173:59644 A / Padding
Ether / IP / TCP 213.180.193.232:https > 192.168.1.173:59644 PA / Raw
Ether / IP / TCP 192.168.1.173:59644 > 213.180.193.232:https PA / Raw
Ether / IP / TCP 192.168.1.173:59644 > 213.180.193.232:https PA / Raw
Ether / IP / TCP 213.180.193.232:https > 192.168.1.173:59644 A / Padding
Ether / IP / TCP 213.180.193.232:https > 192.168.1.173:59644 A / Padding
Ether / IP / TCP 192.168.1.173:59176 > 172.64.155.209:https PA / Raw
Ether / IP / TCP 192.168.1.173:59176 > 172.64.155.209:https PA / Raw
Ether / IP / TCP 213.180.193.232:https > 192.168.1.173:59644 A / Raw
Ether / IP / TCP 213.180.193.232:https > 192.168.1.173:59644 PA / Raw
Ether / IP / TCP 213.180.193.232:https > 192.168.1.173:59644 PA / Raw
Ether / IP / TCP 192.168.1.173:59644 > 213.180.193.232:https A / Padding
Ether / IP / TCP 172.64.155.209:https > 192.168.1.173:59176 A / Padding
Ether / IP / TCP 172.64.155.209:https > 192.168.1.173:59176 A / Padding
Ether / IP / TCP 172.64.155.209:https > 192.168.1.173:59176 A / Padding
Ether / IP / TCP 172.64.155.209:https > 192.168.1.173:59176 A / Padding
Ether / IP / TCP 172.64.155.209:https > 192.168.1.173:59176 A / Padding
Ether / IP / TCP 172.64.155.209:https > 192.168.1.173:59176 PA / Raw
Ether / IP / TCP 172.64.155.209:https > 192.168.1.173:59176 PA / Raw
Ether / IP / TCP 172.64.155.209:https > 192.168.1.173:59176 PA / Raw
Ether / IP / TCP 192.168.1.173:59176 > 172.64.155.209:https A / Padding
Ether / IP / TCP 192.168.1.173:59176 > 172.64.155.209:https PA / Raw
Ether / IP / TCP 172.64.155.209:https > 192.168.1.173:59176 A / Padding
Ether / IP / TCP 213.180.204.179:https > 192.168.1.173:58101 PA / Raw
Ether / IP / TCP 192.168.1.173:58101 > 213.180.204.179:https A / Padding
